<?xml version="1.0" encoding="UTF-8"?>
<!DOCTYPE LexicalResource SYSTEM "http://globalwordnet.github.io/schemas/WN-LMF.dtd">
<LexicalResource>
    <Lexicon label="Princeton WordNet" language="eng">
        <LexicalEntry id="w1">
            <Lemma writtenForm="entity" partOfSpeech="n"/>
            <Sense id="pwn-100001740-n-1" synset="pwn-100001740-n"/>
        </LexicalEntry>
        <LexicalEntry id="w2">
            <Lemma writtenForm="able" partOfSpeech="a"/>
            <Sense id="pwn-300001740-a-1" synset="pwn-300001740-a">
                <SenseRelation relType="antonym" target="pwn-300002908-a-1"/>
            </Sense>
        </LexicalEntry>
        <Synset id="pwn-100001740-n" ili="i35545">
            <Definition gloss="that which is perceived or known or inferred to have its own distinct existence (living or nonliving)" iliDef=""/>
            <SynsetRelation relType="hyponym" target="pwn-104431553-n"/>
            <SynsetRelation relType="hyponym" target="pwn-100002137-n"/>
            <SynsetRelation relType="hyponym" target="pwn-100001930-n"/>
        </Synset>
        <Synset id="pwn-300001740-a" ili="i1">
            <Definition gloss="(usually followed by `to') having the necessary means or skill or know-how or authority to do something" iliDef=""/>
            <SynsetRelation relType="attribute" target="pwn-105624029-n"/>
            <SynsetRelation relType="attribute" target="pwn-105204437-n"/>
        </Synset>
        <Meta
            publisher="Global Wordnet Association"
            description="Example lexicon" />
    </Lexicon>
</LexicalResource>
        
